{
  "project": {
    "name": "SaaS de nicho de ejemplo",
    "type": "saas_b2b",
    "classification_confidence": 90,
    "description": "Ejemplo sintético para demostrar el contrato de evaluación."
  },
  "decision_frame": {
    "decision": "Invertir en un piloto pagado",
    "commitment_scope": "Piloto concierge de cuatro semanas",
    "horizon": "6 meses",
    "currency": "USD",
    "geography": "Estados Unidos"
  },
  "founder_context": {
    "people": 1,
    "weekly_hours": 15,
    "budget": 5000
  },
  "dimensions": {
    "problem": { "weight": 15, "score": 72, "pre_red_team_score": 76, "confidence": 65, "evidence_strength": 3, "positive_factors": ["Cinco compradores objetivo describieron el costo manual recurrente"], "negative_factors": ["Aún no hay comportamiento pagado"], "evidence_ids": ["S01"], "unknowns": ["Costo de la inacción en todo el segmento"], "rationale": "El problema parece real pero el comportamiento de pago no está verificado." },
    "customer": { "weight": 11, "score": 68, "pre_red_team_score": 70, "confidence": 60, "evidence_strength": 2, "positive_factors": ["Los roles de usuario y comprador están nombrados"], "negative_factors": ["El dueño del presupuesto no está confirmado"], "evidence_ids": ["S01"], "unknowns": ["Proceso de aprobación"], "rationale": "El ICP es lo suficientemente específico para un piloto, pero el procurement sigue siendo desconocido." },
    "market": { "weight": 7, "score": 55, "pre_red_team_score": 58, "confidence": 45, "evidence_strength": 2, "positive_factors": ["Existe una lista de 300 cuentas que coinciden"], "negative_factors": ["La incidencia del problema es desconocida"], "evidence_ids": ["S02"], "unknowns": ["Incidencia del problema alcanzable"], "rationale": "El alcance es tangible pero el mercado efectivo no está establecido." },
    "competition": { "weight": 7, "score": 62, "pre_red_team_score": 64, "confidence": 55, "evidence_strength": 2, "positive_factors": ["Las alternativas actuales requieren consolidación manual"], "negative_factors": ["Una funcionalidad empaquetada del incumbente puede ser suficiente"], "evidence_ids": ["S02"], "unknowns": ["Comportamiento de cambio"], "rationale": "Hay espacio para mejorar el workflow, pero el valor del cambio necesita prueba." },
    "differentiation": { "weight": 8, "score": 58, "pre_red_team_score": 65, "confidence": 50, "evidence_strength": 2, "positive_factors": ["Conocimiento del workflow de nicho"], "negative_factors": ["El set de funcionalidades es fácil de copiar"], "evidence_ids": ["S01"], "unknowns": ["Durabilidad de la ventaja del workflow"], "rationale": "Existe relevancia inicial sin una moat fuerte." },
    "product": { "weight": 7, "score": 45, "pre_red_team_score": 45, "confidence": 70, "evidence_strength": 3, "positive_factors": ["El proceso concierge puede entregar el resultado central"], "negative_factors": ["El producto de software no está construido"], "evidence_ids": ["S03"], "unknowns": ["Esfuerzo de onboarding self-service"], "rationale": "Un piloto es entregable, pero la madurez del producto es intencionalmente baja." },
    "monetization": { "weight": 11, "score": 52, "pre_red_team_score": 60, "confidence": 40, "evidence_strength": 1, "positive_factors": ["Existe una hipótesis de precio mensual basada en valor"], "negative_factors": ["No se ha hecho ninguna solicitud de pago"], "evidence_ids": ["S01"], "unknowns": ["Disposición a pagar"], "rationale": "El precio es un supuesto testeable, no evidencia." },
    "acquisition": { "weight": 12, "score": 64, "pre_red_team_score": 68, "confidence": 55, "evidence_strength": 2, "positive_factors": ["El fundador tiene acceso directo a 40 compradores objetivo"], "negative_factors": ["Sin datos de conversión"], "evidence_ids": ["S02"], "unknowns": ["Tasas de reuniones y cierres"], "rationale": "Los primeros diez compradores son alcanzables, pero la escala no está probada." },
    "economics": { "weight": 10, "score": 48, "pre_red_team_score": 55, "confidence": 35, "evidence_strength": 1, "positive_factors": ["El costo de software variable esperado es bajo"], "negative_factors": ["El tiempo de soporte, el CAC y el churn son desconocidos"], "evidence_ids": ["S03"], "unknowns": ["CAC", "Churn", "Horas de soporte"], "rationale": "La economía aún no puede respaldar una inversión de producción." },
    "execution_risk": { "weight": 5, "score": 75, "pre_red_team_score": 75, "confidence": 70, "evidence_strength": 3, "positive_factors": ["El piloto no necesita datos regulados ni integraciones complejas"], "negative_factors": ["La capacidad del fundador es limitada"], "evidence_ids": ["S03"], "unknowns": ["Necesidades de integración después del piloto"], "rationale": "El próximo experimento es factible dentro de las restricciones." },
    "founder_fit": { "weight": 7, "score": 78, "pre_red_team_score": 80, "confidence": 65, "evidence_strength": 3, "positive_factors": ["El fundador tiene acceso de dominio y suficientes horas para un piloto"], "negative_factors": ["Sin capacidad de venta dedicada más allá del fundador"], "evidence_ids": ["S02"], "unknowns": ["Interés de largo plazo en el soporte"], "rationale": "El fit es fuerte para validación, no todavía para escala." }
  },
  "evidence": [
    { "id": "S01", "label": "EVIDENCE", "statement": "Cinco resúmenes sintéticos de entrevistas describen el problema.", "strength": 2, "source": "Notas sintéticas de entrevistas", "date": "2026-08-13", "direction": "supporting", "limitations": "Muestra de conveniencia pequeña y sin comportamiento de pago." },
    { "id": "S02", "label": "FACT", "statement": "Una lista sintética contiene 300 cuentas que coinciden y 40 contactos del fundador.", "strength": 3, "source": "Export sintético de CRM", "date": "2026-08-13", "direction": "supporting", "limitations": "La alcanzabilidad no prueba necesidad ni conversión." },
    { "id": "S03", "label": "ESTIMATE", "statement": "Un piloto concierge puede entregarse en 60 horas y USD 1.000.", "strength": 2, "source": "Estimación sintética del fundador", "date": "2026-08-13", "direction": "mixed", "limitations": "No verificada por la entrega." }
  ],
  "unknowns": [
    { "item": "Disposición a pagar USD 500 por mes", "decision_impact": "critical", "resolution": "Solicitar tres compromisos de piloto pagado a compradores calificados." }
  ],
  "assumptions": [
    { "item": "Precio del piloto", "value": 500, "sensitivity": "Por debajo de USD 300, el tiempo de entrega del fundador puede volver el modelo poco atractivo." }
  ],
  "financial_scenarios": {
    "pessimistic": { "customers": 2, "monthly_arpu": 300, "variable_costs": 100, "fixed_costs": 200, "acquisition_spend": 600, "new_customers": 2, "monthly_churn_rate": 0.1, "founder_hours": 30, "one_time_capital": 1000 },
    "base": { "customers": 5, "monthly_arpu": 500, "variable_costs": 250, "fixed_costs": 300, "acquisition_spend": 1000, "new_customers": 5, "monthly_churn_rate": 0.05, "founder_hours": 35, "one_time_capital": 1000 },
    "optimistic": { "customers": 10, "monthly_arpu": 650, "variable_costs": 500, "fixed_costs": 500, "acquisition_spend": 1500, "new_customers": 10, "monthly_churn_rate": 0.03, "founder_hours": 45, "one_time_capital": 1500 }
  },
  "red_team": {
    "performed": true,
    "attacks": [
      { "id": "RT01", "challenged_claim": "El interés de las entrevistas implica disposición a pagar.", "failure_mechanism": "Las respuestas corteses de las entrevistas pueden desaparecer cuando se solicita el pago.", "severity": "critical", "likelihood": "high", "affected_dimensions": ["monetization", "economics"], "score_impact": -8, "falsification_test": "Asegurar tres pilotos pagados de USD 500 por mes o más." }
    ],
    "global_adjustment": 0
  },
  "deal_breakers": [
    { "risk": "La disposición a pagar no está verificada", "status": "open", "severity": "high", "verdict_ceiling": "VALIDATE", "evidence_ids": ["S01"], "remediation": "Obtener tres compromisos de piloto pagado." }
  ],
  "experiments": [
    { "hypothesis": "Los compradores calificados pagarán USD 500 por mes por el resultado.", "method": "Ofrecer un piloto concierge de cuatro semanas a 15 cuentas calificadas.", "success_threshold": "Al menos tres pilotos firmados y pagados.", "failure_threshold": "Cero pilotos pagados después de 15 ofertas calificadas.", "cost": "60 horas del fundador y como máximo USD 1.000", "duration": "Cuatro semanas", "decision_changed": "El éxito permite construir la automatización mínima; el fracaso dispara un pivot de precio o problema." }
  ],
  "proposed_verdict": "VALIDATE",
  "confidence_penalty": 4
}